event_id_cnty,event_date,year,time_precision,disorder_type,event_type,sub_event_type,actor1,assoc_actor_1,inter1,actor2,assoc_actor_2,inter2,interaction,civilian_targeting,iso,region,country,admin1,admin2,admin3,location,latitude,longitude,geo_precision,source,source_scale,notes,fatalities,tags,timestamp
BRA210,2019-01-06,2019,1,Political violence,Battles,Armed clash,Military Forces of Brazil (2019-2022) Military Police,,State forces,PCC: First Capital Command,,Political militia,State forces-Political militia,,76,South America,Brazil,Ceara,Fortaleza,,Fortaleza,-3.7172,-38.5431,1,Agencia Brasil; Bnews (Brazil),National,"On 6 January 2019, in Fortaleza (Ceara), military police officers exchanged gunfire with at least two drug traffickers from the First Capital Command (PCC) after they set fire to a state department of transit service station (DETRAN) in the Granja Portugal neighbourhood. The wave of attacks in the state of Ceara started after the new secretary of Penitentiary Administration stated that he did not recognize criminal factions in the state of Ceara. According to ongoing investigations, criminal factions operating in Ceara (PCC, CV, and Guardians of the State) have joined forces to retaliate. Two suspects were shot and killed and one police officer was shot in the hand. The police seized ballistic vests, weapons, Molotov cocktails, fuel, and a vehicle. 2 fatalities.",2,,1730827889
UKR12235,2018-11-13,2018,1,Political violence,Battles,Armed clash,Military Forces of Ukraine (2014-2019),,State forces,NAF: United Armed Forces of Novorossiya,Donetsk People's Militia,Rebel group,State forces-Rebel group,,804,Europe,Ukraine,Donetsk,Horlivskyi,Horlivska,Shakhta imeni Gagarina,48.3435,37.942,2,Donetsk News Agency; Interfax; Novorossia Today,Subnational-Regional,"On 13 November 2018, the Military Forces of Ukraine fired at the positions of the DPR militia near Shakhata imeni Gagarina using mortars, grenade launchers and small arms .",0,,1680636679
SYR46463,2018-09-10,2018,1,Political violence,Explosions/Remote violence,Shelling/artillery/missile attack,Unidentified Armed Group (Syria),,Political militia,HTS: Hayat Tahrir al Sham,Civilians (Syria),Rebel group,Rebel group-Political militia,,760,Middle East,Syria,Idleb,Harim,Salqin,Salqin,36.139,36.4537,1,Liveuamap; SNHR; SOHR; Undisclosed Source,Local partner-Other,"An IED exploded near a police station in the town of Salqin, killing 3 HTS fighters and 2 civilians.",5,,1720478416
BRA1714,2019-02-24,2019,1,Political violence,Battles,Armed clash,Military Forces of Brazil (2019-2022) Military Police,,State forces,Unidentified Gang and/or Police Militia,,Political militia,State forces-Political militia,,76,South America,Brazil,Sao Paulo,Paulo de Faria,,Paulo de Faria,-20.03,-49.4004,1,G1,National,"On 24 February 2019, in Paulo de Faria (SP), an armed suspect engaged in an armed confrontation with the Military Police. During the shootings, the armed suspect was shot and killed. The weapons used by the police were seized and the case is being investigated by the Civil and Military Police.",1,,1673316829
BOL1341,2020-11-29,2020,1,Political violence,Riots,Mob violence,Rioters (Bolivia),Labor Group (Bolivia),Rioters,Military Forces of Bolivia (2020-),,State forces,State forces-Rioters,,68,South America,Bolivia,Oruro,Litoral de Atacama,Huachacalla,Huachacalla,-18.7931,-68.2618,1,Los Tiempos (Bolivia),National,"On 29 November 2020, in Huachacalla, Oruro, residents rioted and set fire to the dome of a military building, to reject a previous police chase and shoot-out carried out by military forces in the area. The officers were chasing a citizen driving an unlicensed truck. Residents also rejected the apprehension of several trucks with contraband merchandise and without license in the previous days.",0,crowd size=no report,1618494335
IND160934,2024-07-01,2024,1,Political violence,Riots,Mob violence,Rioters (India),Unidentified Caste Group (India),Rioters,Civilians (India),Unidentified Caste Group (India),Civilians,Rioters-Civilians,Civilian targeting,356,South Asia,India,Punjab,Bathinda,Talwandi Sabo,Teona Pujarian,29.9285,75.0766,1,Amar Ujala,Subnational,"On 1 July 2024, more than a dozen family members of a woman assaulted her husband and his family members in Teona Pujarian village (Bathinda, Punjab) expressing their dissatisfaction over the girl's inter-caste marriage with the man. The man succumbed to his injuries while his family members were left with serious injuries.",1,crowd size=more than a dozen,1720552462
VEN10275,2021-07-19,2021,1,Demonstrations,Protests,Peaceful protest,Protesters (Venezuela),,Protesters,,,,Protesters only,,862,South America,Venezuela,Lara,Iribarren,,Barquisimeto,10.0647,-69.357,3,OVCS: Observatorio Venezolano de Conflictividad Social,Other,"On 19 July 2021, in Lara state (coded to Barquisimeto, Lara), protesters gathered to demand coronavirus vaccines, as well as political and labour rights.",0,crowd size=no report,1627333140
PSE39337,2023-10-29,2023,1,Strategic developments,Strategic developments,Other,Military Forces of Israel (2022-),,External/Other forces,Civilians (Palestine),Farmers (Palestine),Civilians,External/Other forces-Civilians,,275,Middle East,Palestine,West Bank,Tulkarm,,Irtah,32.2982,35.0154,1,PLO Negotiations Affairs Department,Other,"Other: On 29 October 2023, Israeli forces fired tear gas canisters at Palestinian farmers near the separation wall in Irtah (Tulkarm, West Bank) while they were collecting olive fruit from lands near the wall.",0,,1722291503
DNK756,2021-04-06,2021,1,Demonstrations,Protests,Peaceful protest,Protesters (Denmark),AM: Public Resistance,Protesters,,,,Protesters only,,208,Europe,Denmark,Hovedstaden,Kobenhavn,,Copenhagen,55.6879,12.5697,1,Arbejderen,National,"On 6 April 2021, Public Resistance movement (Almen Modstand) activists gathered in front of the Parliament of Denmark in Copenhagen to oppose the government bills also known as the 'ghetto package', which include the physical demolition of municipal housing and forced relocation of people from certain areas of the city.",0,crowd size=no report,1618333311
DEU731,2020-02-18,2020,1,Demonstrations,Protests,Peaceful protest,Protesters (Germany),,Protesters,,,,Protesters only,,276,Europe,Germany,Niedersachsen,Region Hannover,,Burgdorf,52.4435,10.0076,1,Weser Kurier Politik,National,"On 18 February 2020, animal rights activists protested in front of an event hosting the Agrarian Minister in Burgdorf near Hannover against the agrarian policy.",0,crowd size=no report,1610633011
CHN10286,2021-04-23,2021,2,Demonstrations,Protests,Peaceful protest,Protesters (China),Labor Group (China),Protesters,,,,Protesters only,,156,East Asia,China,Jiangsu,Nantong,Chongchuan,Chongchuan,32.0098,120.8574,2,CLB (China),Other,"Around 23 April 2021 (as reported), workers filed for arbitration and demonstrated in Nantong prefecture (Jiangsu) (coded to Chongchuan) to demand for wage arrears owed by a state-owned construction company.",0,crowd size=no report,1627402193
UKR138853,2023-12-02,2023,1,Political violence,Explosions/Remote violence,Shelling/artillery/missile attack,Military Forces of Russia (2000-),,External/Other forces,,,,External/Other forces only,,804,Europe,Ukraine,Sumy,Shostkynskyi,Seredyno-Budska,Seredyna-Buda,52.189,34.0364,1,Ministry of Defence of Ukraine; Suspilne Media,Other-National,"On 2 December 2023, Russian forces fired suspected 82mm mortars Seredyna-Buda, Sumy. There were no casualties.",0,,1712177099
ARM5226,2021-05-21,2021,1,Demonstrations,Protests,Peaceful protest,Protesters (Azerbaijan),Refugees/IDPs (Azerbaijan); Armenian Group (Azerbaijan),Protesters,,,,Protesters only,,51,Caucasus and Central Asia,Armenia,Yerevan,Yerevan,,Yerevan,40.1811,44.5136,1,A1+,National,"On 21 May 2021, Armenian refugees from Artsakh protested in front of the Russian Embassy in Yerevan, Armenia demanding that the Collective Security Treaty Organization fulfils its obligations and provides Armenia with military support in the Syunik region.",0,crowd size=no report,1722371860
MMR51907,2023-09-06,2023,1,Strategic developments,Strategic developments,Looting/property destruction,Military Forces of Myanmar (2021-),,State forces,Civilians (Myanmar),,Civilians,State forces-Civilians,,104,Southeast Asia,Myanmar,Sagaing,Kanbalu,Kanbalu,Lel Hla,23.0663,95.5177,1,Radio Free Asia,Regional,"Property destruction: On 6 September 2023, in Lel Hla village (Kanbalu township, Kanbalu district, Sagaing region), the military set fire to some houses in the morning.",0,,1694525367
SYR31465,2018-04-14,2018,1,Political violence,Explosions/Remote violence,Shelling/artillery/missile attack,Military Forces of Syria (2000-),,State forces,,,,State forces only,,760,Middle East,Syria,Hama,As Salamiyeh,As Salamiyeh,Al Satheyat,34.9574,36.9426,2,SOHR,Other,The Syrian army shelled Al Satheyat area in Hama countryside. Neither injuries nor fatalities were reported.,0,,1720478345
IND146278,2023-12-09,2023,2,Demonstrations,Protests,Peaceful protest,Protesters (India),Farmers (India),Protesters,,,,Protesters only,,356,South Asia,India,Madhya Pradesh,Jabalpur,Jabalpur,Jabalpur,23.1669,79.95,1,Free Press Journal (India),National,"Around 9 December 2023 (as reported), farmers staged a protest in Jabalpur city (Madhya Pradesh) demanding support from the government for crops damaged due to rain.",0,crowd size=no report,1704833948
UKR185769,2024-09-27,2024,1,Political violence,Battles,Armed clash,Military Forces of Russia (2000-),,External/Other forces,Military Forces of Ukraine (2019-),,State forces,State forces-External/Other forces,,804,Europe,Ukraine,Donetsk,Kramatorskyi,Druzhkivska,Druzhkivka,48.6165,37.5292,2,Ministry of Defence of Russia,National,"On 27 September 2024, Russian forces attacked Ukrainian forces near Druzhkivka, Donetsk. According to Russian sources, more than 725 Ukrainian soldiers were killed near Kostiantynivka, Slovyansk, Zaliznianske, Druzhkivka, Kurakhove, Hryhorivka and Chasiv Yar [Russian MoD reported 725 fatalities. Coded as 10 fatalities split across 7 events. 2 fatalities coded to this event].",2,,1727819878
PSE18113,2022-12-12,2022,1,Political violence,Riots,Mob violence,Rioters (Palestine),,Rioters,Military Forces of Israel (2021-2022),,External/Other forces,Rioters-External/Other forces,,275,Middle East,Palestine,West Bank,Tulkarm,,Tulkarm,32.3104,35.0286,1,PLO Negotiations Affairs Department,Other,"On 12 December 2022, Palestinian rioters hurled stones toward Israeli military forces who raided Tulkarm city (Tulkarm, West Bank). Soldiers fired rubber bullets, stun grenades, and tear gas canisters at rioters.",0,crowd size=no report,1722291502
FRA10871,2021-07-31,2021,1,Demonstrations,Protests,Peaceful protest,Protesters (France),,Protesters,,,,Protesters only,,250,Europe,France,Auvergne-Rhone-Alpes,Rhone,Lyon,Lyon,45.764,4.8357,1,BFM,National,"On 31 July 2021, around 1,000 persons demonstrated in Lyon. They called for the withdrawal of a coronavirus-related bill on the obligation to provide the proof of the double vaccination to resume some professional and social activities. Tensions were reported with no further details nor mentions of injuries or fatalities.",0,"crowd size=around 1,000",1727819482
IND110606,2022-05-10,2022,1,Demonstrations,Protests,Peaceful protest,Protesters (India),AAP: Aam Aadmi Party,Protesters,,,,Protesters only,,356,South Asia,India,Himachal Pradesh,Shimla,Shimla,Shimla,31.1044,77.1666,3,United News of India,National,"On 10 May 2022, AAP members staged protests, across HP coded as Shimla (Shimla district, HP), against the deteriorating law and order situation in the state.",0,crowd size=no report,1652797494
VEN21942,2024-01-10,2024,1,Demonstrations,Protests,Peaceful protest,Protesters (Venezuela),Labor Group (Venezuela),Protesters,,,,Protesters only,,862,South America,Venezuela,Bolivar,Caroni,,Ciudad Guayana,8.295,-62.7191,1,Correo del Caroni,Subnational,"On 10 January 2024, in Ciudad Guayana (Bolivar), a group of retired workers at companies belonging to the state-owned Venezuelan Corporation of Guayana (CVG), pensioners, and representatives of the Bolivar state Federation of Associations of Retired Workers and Pensioners (FEDAJUPEBOL), and the CVG Carbonorca workers' union, gathered outside the CVG headquarters to demand payment of owed stipends, observance of their collective labor agreements, the restoration of their medical insurance and burial plans (HCM), and better medical attention.",0,crowd size=no report,1705371876
AZE14204,2020-04-30,2020,1,Political violence,Battles,Armed clash,Military Forces of Artsakh (2007-),,State forces,Military Forces of Azerbaijan (2003-),,State forces,State forces-State forces,,31,Caucasus and Central Asia,Azerbaijan,Tartar,,,Shikharkh,40.3318,46.8882,2,Ministry of Defence of Azerbaijan,Other,"On 30 April 2020, military forces of Artsakh located at Goyarkh fired with unspecified weapons on the positions of the military forces of Azerbaijan assumed to be located near Shikharkh, Tartar.",0,,1727134499
IND76696,2020-07-01,2020,1,Demonstrations,Protests,Peaceful protest,Protesters (India),,Protesters,,,,Protesters only,,356,South Asia,India,Karnataka,Ballari,Hospet,Hosapete,15.2695,76.3871,1,New Indian Express,Subnational,"On 1 July 2020, a protest was held in Hosapete city (Ballari, KN) against the decision of medical workers to take the body of a Coronavirus positive patient to the burial ground.",0,crowd size=no report,1618500481
NIG23791,2022-02-21,2022,1,Political violence,Battles,Armed clash,Military Forces of Nigeria (2015-2023),,State forces,IPOB: Indigenous Peoples of Biafra,,Rebel group,State forces-Rebel group,,566,Western Africa,Nigeria,Anambra,Ihiala,,Lilu,5.8865,6.9464,2,Daily Independent (Nigeria); Daily Post (Nigeria),National,"On 21 February 2022, Nigerian troops during a clearance patrol clashed with IPOB militants in Lilu forest (Ihiala, Anambra). Casualties unknown.",0,,1702343241
NIG21406,2021-07-18,2021,1,Political violence,Battles,Armed clash,Unidentified Communal Militia (Nigeria),,Identity militia,Military Forces of Nigeria (2015-2023),,State forces,State forces-Identity militia,,566,Western Africa,Nigeria,Zamfara,Gusau,,Gusau,12.1628,6.6614,2,Blueprint; Daily Champion; Daily Post (Nigeria),National,"On 18 July 2021, an Alpha Jet aircraft from the Nigerian air force was gunned down by militia members between the boundaries of Kaduna and Zamfara [coded Gusau]. The pilot survived.",0,,1726526141
PAK83963,2023-06-11,2023,1,Demonstrations,Protests,Peaceful protest,Protesters (Pakistan),JI: Jamaat-e-Islami,Protesters,,,,Protesters only,,586,South Asia,Pakistan,Sindh,Karachi City,Karachi South,Karachi - Lyari,24.8687,66.9946,1,Pakistan Press International,National,"On 11 June 2023, activists of JI held a protest demonstration in Karachi - Lyari town (Karachi City, Sindh), against the PPP activists' attempt to 'manipulate' mayor election in Karachi.",0,crowd size=no report,1687271788
EST317,2022-10-03,2022,1,Demonstrations,Protests,Peaceful protest,Protesters (Estonia),Women (Estonia),Protesters,,,,Protesters only,,233,Europe,Estonia,Harju,Tallinn,,Tallinn,59.4367,24.7474,1,Delfi - Estonian News,National,"On 3 October 2022, a group of women protested in front of the Russian Embassy in Tallinn, Estonia calling against the Russian invasion of Ukraine.",0,crowd size=no report,1680633817
SYR97556,2021-12-12,2021,1,Political violence,Explosions/Remote violence,Shelling/artillery/missile attack,Operation Peace Spring,JWS: Syrian National Army,Rebel group,QSD: Syrian Democratic Forces,,Rebel group,Rebel group-Rebel group,,760,Middle East,Syria,Ar Raqqa,Tell Abiad,Tell Abiad,Tell Abiad,36.6978,38.9548,2,SHAAM,National,"On 12 December 2021, JWS operating under OPS shelled QSD positions in Um Al Shibl in Tell Abiad area in Ar-Raqqa using artillery fire. JWS shelling on Um Al Baramil and Al Shibl resulted in an unknown number of fatalities and wounded. Total fatalities coded as 10 and split between the two events with 5 coded to each.",5,,1720478768
JAM1469,2022-08-12,2022,1,Demonstrations,Protests,Peaceful protest,Protesters (Jamaica),,Protesters,,,,Protesters only,,388,Caribbean,Jamaica,Kingston,,,Kingston,17.9712,-76.7928,1,Jamaica Gleaner,National,"On 12 August 2022, in Kingston, Kingston, for the second consecutive day, relatives and supporters of a social media personality held a protest outside the Court House to claim for justice after her killing. The protest took place on the day that the victim's boyfriend, who had been accused of being the perpetrator, made his appearance in Court.",0,crowd size=no report,1660572136
SYR126362,2024-04-02,2024,1,Political violence,Explosions/Remote violence,Air/drone strike,Military Forces of Turkey (2016-),,External/Other forces,,,,External/Other forces only,,760,Middle East,Syria,Aleppo,Azaz,Azaz,Al-Malikeyyeh,36.5435,36.9904,1,SOHR,Other,"On 2 April 2024, Turkish forces conducted a drone strike on an unspecified position in the village of Al-Malikeyyeh in the countryside of Aleppo. Casualties unknown.",0,,1721691372
BGD22127,2022-06-01,2022,1,Demonstrations,Protests,Peaceful protest,Protesters (Bangladesh),,Protesters,,,,Protesters only,,50,South Asia,Bangladesh,Mymensingh,Jamalpur,Jamalpur Sadar,Jamalpur,24.9197,89.9481,1,Prothom Alo,National,"On 1 June 2022, locals and members of various organizations staged protest at Jamalpur Railway Station, Jamalpur city (Jamalpur sadar), against the cancellation of a 60-seat compartment of the Dhaka-bound inter-city Teesta Express train.",0,crowd size=no report,1726526020
MMR82040,2024-06-14,2024,1,Political violence,Violence against civilians,Attack,Unidentified Armed Group (Myanmar),,Political militia,Civilians (Myanmar),Former Military Forces of Myanmar (2021-),Civilians,Political militia-Civilians,Civilian targeting,104,Southeast Asia,Myanmar,Mandalay,Pyinoolwin,Singu,Nwe Yon,22.6695,96.0146,1,Khit Thit Media,Subnational,"On 14 June 2024, in Nwe Yon village (Singu township, Pyinoolwin district, Mandalay region), an unknown armed group shot and killed a man who was a former military captain at his house around 4:30 pm. Locals claimed he allegedly gathered information for the military and was involved in the military conscription process. No group claimed responsibility for the attack.",1,,1731645300
LBN21100,2024-05-17,2024,1,Political violence,Explosions/Remote violence,Air/drone strike,Military Forces of Israel (2022-),,External/Other forces,Civilians (Lebanon),Farmers (Lebanon),Civilians,External/Other forces-Civilians,Civilian targeting,422,Middle East,Lebanon,South,Sayda,,Ez Zahrani,33.4973,35.3401,1,El Nashra; Lebanon24; Murr TV; National News Agency Lebanon,National,"On 17 May 2024, Israeli warplanes carried out an airstrike in Ez Zahrani town (Sayda, South) amid ongoing hostilities with Hezbollah. Several farmers were injured in the strike.",0,,1727907800
ISR16025,2023-09-11,2023,1,Demonstrations,Protests,Peaceful protest,Protesters (Israel),,Protesters,,,,Protesters only,,376,Middle East,Israel,HaMerkaz,Rehovot,Rehovot,Rehovot,31.8942,34.812,1,Times of Israel,National,"On 11 September 2023, a protest took place in Rehovot (HaMerkaz) against the Netanyahu-led coalition's planned judicial overhaul. The protest took place a day ahead of a Supreme Court hearing on the major piece of judicial overhaul legislation that revoked the reasonableness standard.",0,crowd size=no report,1729632672
IRN16752,2017-10-02,2017,1,Demonstrations,Protests,Peaceful protest,Protesters (Iran),,Protesters,,,,Protesters only,,364,Middle East,Iran,Mazandaran,Sari,Central,Sari,36.5633,53.0601,1,Free Union of Iranian Workers,Other,"On 2 October 2017, depositors at Caspian Finance and Credit Institution held a protest in front of its branches in Sari (Mazandaran). The reason for the demonstration was not reported.",0,crowd size=no report,1646060631
IRQ12601,2016-11-14,2016,1,Political violence,Battles,Government regains territory,Military Forces of Iraq (2014-2018),,State forces,Islamic State in Iraq and the Levant (ISIL),,Rebel group,State forces-Rebel group,,368,Middle East,Iraq,Salah Al Din,Samarra,Al Tharthar,Muhayjir,34.2667,43.8167,1,Iraqi News,National,"On 14 November 2016, popular mobilization forces, have reportedly liberated the Muhayjir area from ISIL. Casualities and material losses occured; unknown count coded as 10.",10,,1730156773
YEM82466,2020-11-20,2020,1,Strategic developments,Strategic developments,Looting/property destruction,Military Forces of Yemen (2012-2022) Hadi,,State forces,Military Forces of Yemen (2017-) Houthi,,State forces,State forces-State forces,,887,Middle East,Yemen,Marib,Medghal,,Al Madid,15.65,44.9625,2,Twitter,New media,"Interception: On 20 November 2020,pro-Hadi forces shot down 4 Houthi drones on the western front of Marib (coded to Medghal district at Al Madid).",0,,1719872679
COL28675,2024-08-27,2024,1,Strategic developments,Strategic developments,Disrupted weapons use,Military Forces of Colombia (2022-),,State forces,Unidentified Armed Group (Colombia),,Political militia,State forces-Political militia,,170,South America,Colombia,Arauca,Arauca,,Arauca,7.0774,-70.7464,1,Monitor - OCHA Colombia,Other,"Defusal: On 27 August 2024, in Arauca (Arauca), state forces (coded as military forces) safely detonated a grenade that was found in the El Malecon area, where the police station had been attacked the previous night (coded separately).",0,,1727907786
IND125019,2023-01-12,2023,1,Demonstrations,Protests,Peaceful protest,Protesters (India),Farmers (India),Protesters,,,,Protesters only,,356,South Asia,India,Jammu and Kashmir,Jammu,Ranbir Singh Pora,Ranbir Singh Pura,32.6049,74.7315,1,Amar Ujala,Subnational,"On 12 January 2023, a large number of farmers led by a farmer leader held a protest by blocking a road at Ranbir Singh Pura city (Jammu district, J&K) over shortage of power supply in their area.",0,crowd size=large,1725414475
MEX69957,2023-01-23,2023,1,Demonstrations,Protests,Peaceful protest,Protesters (Mexico),Taxi/Bus Drivers (Mexico),Protesters,,,,Protesters only,,484,North America,Mexico,Tabasco,Centro,,Villahermosa,17.9878,-92.9194,1,Tabasco Hoy,Subnational,"On 23 January 2023, in Villahermosa, Tabasco, taxi drivers and members of the Teapa Taxi Union protested outside the doors of the Government Palace to demand the provision of concessions. Protesters also denounced the presence of drivers who are not regulated or members of the union, therefore creating more competition.",0,crowd size=no report,1725317937
AUS729,2022-01-15,2022,1,Demonstrations,Protests,Peaceful protest,Protesters (Australia),Government of Australia (2013-2022); UAP: United Australia Party,Protesters,,,,Protesters only,,36,Oceania,Australia,New South Wales,Sydney,,Sydney - Eastern,-33.9067,151.1825,1,Newcastle Herald; WA Today; Examiner (Launceston); Daily Telegraph; The Age (Australia); 9News; Katherine Times; Sydney Morning Herald; Illawarra Mercury; Brisbane Times,Subnational-National,"On 15 January 2022, at least 1000-thousands of protesters marched along Elizabeth street in Sydney - Eastern (New South Wales) to oppose coronavirus restrictions and vaccination mandates. The group additionally voiced discontent over the detention of a world number one tennis star over discrepancies on his visa application form. A federal MP from the United Australia Party spoke at the rally, describing the tennis start as a 'political prisoner' and called the government a 'regime.'",0,crowd size=at least 1000-thousands,1680633685
IDN10042,2022-09-20,2022,1,Demonstrations,Protests,Peaceful protest,Protesters (Indonesia),,Protesters,,,,Protesters only,,360,Southeast Asia,Indonesia,Central Java,Semarang,Central Samalang,Semarang,-6.9913,110.426,1,Detik,National,"On 20 September 2022, between 50 to 60 people held a demonstration in front of the council building on Pahlawan Road, Semarang city (Central Java province). They opposed the increase in fuel prices. They also opposed the revision of criminal code law and the investigation of human rights violation cases. They burned tires.",0,crowd size=between 50 to 60,1709061525
TUR30334,2023-07-08,2023,1,Demonstrations,Protests,Peaceful protest,Protesters (Turkey),Government of Turkey (2016-); CHP: Republican Peoples Party,Protesters,,,,Protesters only,,792,Middle East,Turkey,Zonguldak,Eregli,,Eregli,41.2826,31.4181,1,Karar,Regional,"On 8 July 2023, tens of thousands of local residents staged a demonstration march in Eregli town, Zonguldak, demanding Eregli be separated from Zonguldak and declared as a province since it meets the eligibility criteria. A CHP MP also attended the event.",0,crowd size=tens of thousands,1689612220
KEN15537,2024-08-30,2024,1,Demonstrations,Protests,Peaceful protest,Protesters (Kenya),KUPPET: Kenya Union of Post Primary Education Teachers; Teachers (Kenya),Protesters,,,,Protesters only,,404,Eastern Africa,Kenya,Migori,Suna West,Ragana-oruba,Migori,-1.0667,34.4667,1,Citizen (Kenya),National,"On 30 August 2024, teachers, mainly KUPPET members from Migori county, protested in Migori (Suna West, Migori) against delayed implementation of their 2021-2025 Collective Bargaining Agreement (CBA) among other concerns. The group demanded the government, through the Teachers' Service Commission (TSC), to address their grievances.",0,crowd size=no report,1725317855
VEN4166,2020-04-29,2020,1,Demonstrations,Protests,Peaceful protest,Protesters (Venezuela),Labor Group (Venezuela),Protesters,,,,Protesters only,,862,South America,Venezuela,Portuguesa,Guanare,,Guanare,9.0418,-69.7421,1,El Pitazo,National,"On 29 April 2020, in Guanare, Portuguesa state, a group of 200 public motorcycle drivers protested in front of the Governor's office to demand the distribution of fuel.",0,crowd size=200,1588632259
