event_id_cnty,event_date,year,time_precision,disorder_type,event_type,sub_event_type,actor1,assoc_actor_1,inter1,actor2,assoc_actor_2,inter2,interaction,civilian_targeting,iso,region,country,admin1,admin2,admin3,location,latitude,longitude,geo_precision,source,source_scale,notes,fatalities,tags,timestamp
PAR3079,2022-02-08,2022,1,Demonstrations,Protests,Peaceful protest,Protesters (Paraguay),OTEP-SN: Organization of Education Workers of Paraguay National Union; Teachers (Paraguay),Protesters,,,,Protesters only,,600,South America,Paraguay,Asuncion,La Recoleta,,Asuncion,-25.2898,-57.5896,1,La Nacion (Paraguay),National,"On 8 February 2022, in Asuncion (Asuncion), members of the Organization of Education Workers of Paraguay National Union (OTEP-SN) protested in front of the headquarters of the Superior Court of Electoral Justice (TSJE) to report irregularities in the union's elections. The group claimed that the union's leaders elected the delegates before the Independent Electoral Tribunal was installed.",0,crowd size=no report,1715049551
IND8162,2016-09-08,2016,1,Demonstrations,Protests,Peaceful protest,Protesters (India),AAP: Aam Aadmi Party,Protesters,,,,Protesters only,,356,South Asia,India,Punjab,SAS Nagar,Mohali,Mohali,30.6799,76.7221,1,Times of India,National,Aadmi party (AAP) volunteers held a protest on Thursday outside SSP office in district administrative complex in Sector 76 in Mohali alleging delay in police action in connection with an attack on family members of Jagdeep Singh.,0,,1651165020
BFO10174,2023-06-15,2023,2,Political violence,Violence against civilians,Attack,JNIM: Group for Support of Islam and Muslims,,Rebel group,Civilians (Burkina Faso),,Civilians,Rebel group-Civilians,Civilian targeting,854,Western Africa,Burkina Faso,Sahel,Yagha,Sebba,Sebba,13.4417,0.5264,2,Whatsapp,New media,"Around 15 June 2023, 3 lifeless bodies were discovered between Sebba (Sebba, Yagha) and Solhan (Solhan, Yagha). They were probably killed by presumed JNIM militants.",1,,1688417501
PSE24991,2018-01-03,2018,1,Strategic developments,Strategic developments,Other,Military Forces of Israel (2009-2021),,External/Other forces,Civilians (Palestine),Farmers (Palestine),Civilians,External/Other forces-Civilians,,275,Middle East,Palestine,Gaza Strip,Deir El Balah,,Al Maghazi,31.4214,34.3865,2,PLO Negotiations Affairs Department,Other,"Other: On 3 January 2018, Israeli forces opened fire towards Palestinian agricultural lands east of Maghazi (Deir El Balah). There were no casualties. *These shots are considered to be warning shots to keep Palestinians away from the border fence, that are not directly targeted at them.",0,,1698715398
NIG13301,2018-11-04,2018,1,Political violence,Violence against civilians,Attack,Fulani Ethnic Militia (Nigeria),Pastoralists (Nigeria),Identity militia,Civilians (Nigeria),,Civilians,Identity militia-Civilians,Civilian targeting,566,Western Africa,Nigeria,Nassarawa,Lafia,,Lafia,8.4833,8.5167,3,Daily Independent (Nigeria),National,"04 November. Fulani attacked the convoy of the Chief of the Udegye chiefdom, Alhaji Bala Usman while he was traveling in Nasarawa.",0,local administrators,1712095448
SYR72115,2019-02-19,2019,3,Political violence,Violence against civilians,Attack,Military Forces of Syria (2000-) Prison Guards,,State forces,Civilians (Syria),Prisoners (Syria),Civilians,State forces-Civilians,Civilian targeting,760,Middle East,Syria,Rural Damascus,At Tall,At Tall,Sidnaya Military Prison,33.6653,36.329,3,SNHR,Local partner-Other,"As reported on February 19, 2019, 2 males from Ar-Rastan died as a result of torture in an unidentified regime prison.",2,,1720478392
SYR14966,2017-10-25,2017,1,Political violence,Explosions/Remote violence,Shelling/artillery/missile attack,Military Forces of Turkey (2016-),,External/Other forces,,,,External/Other forces only,,760,Middle East,Syria,Aleppo,Ain Al Arab,Lower Shyookh,Ashmah,36.8761,38.1074,1,SOHR,Other,Areas of Kusik and Ashmah villages in the countryside of Ain Al Arab were targeted with medium and heavy machine gun artillery as Turkish forces targeted YPG-held areas. The shooting caused material damage. No fatalities reported.,0,,1720478203
COL11810,2022-07-19,2022,1,Political violence,Violence against civilians,Attack,Unidentified Armed Group (Colombia),,Political militia,Civilians (Colombia),Women (Colombia); Unidentified Communal Group (Colombia); Afro-Colombian Ethnic Group (Colombia),Civilians,Political militia-Civilians,Civilian targeting,170,South America,Colombia,Narino,Tumaco,,Tumaco,1.8071,-78.7639,1,INDEPAZ,Other,"On 19 July 2022, in Tumaco (Narino), an Afro-Colombian woman, who was also a social leader, was shot and killed by unknown perpetrators inside her house in Los Angeles neighborhood. The motive of the attack is unknown but there is presence of armed groups in the area. 1 fatality.",1,women targeted: activists/human rights defenders/social leaders,1658775901
NOR1289,2023-10-13,2023,1,Demonstrations,Protests,Peaceful protest,Protesters (Norway),NSR-N: Youth Committee of the Norwegian Sami Association; Sami Indigenous Group (Norway); NU: Nature and Youth Norway,Protesters,,,,Protesters only,,578,Europe,Norway,Oslo,Oslo,,Oslo,59.911,10.7531,1,Vart Land,National,"On 13 October 2023, people demonstrated outside of the Royal Palace in Oslo to oppose the continued operation of wind power mills in the Fosen district, despite a Supreme Court ruling that the license was invalid. Activists from the Youth Committee of the Norwegian Sami Association (NSR-N) and the Nature and Youth Norway (NU) took part in the event.",0,crowd size=no report,1697557201
YEM34153,2015-04-23,2015,1,Political violence,Explosions/Remote violence,Air/drone strike,Operation Restoring Hope,,External/Other forces,Military Forces of Yemen (2015-2017) Houthi-Saleh,,State forces,State forces-External/Other forces,,887,Middle East,Yemen,Ad Dali,Qaatabah,,Jabal Murays,13.9667,44.6833,1,Yemen Data Project,Local partner-National,Coalition airstrikes hit military site in Qaatabah,0,,1690843542
USA51246,2022-07-16,2022,1,Demonstrations,Protests,Peaceful protest,Protesters (United States),Downright Impolite; Women (United States),Protesters,,,,Protesters only,,840,North America,United States,Virginia,Alexandria,,Alexandria,38.8048,-77.0469,1,Twitter,New media,"On 16 July 2022, an unreported number of people demonstrated outside of the home of Supreme Court Justice Samuel Alito in Alexandria (Virginia) in support of abortion rights and in opposition to the Justice. The protest was organized by Our Rights DC and Downright Impolite.",0,crowd size=no report,1710874095
BGD9328,2010-11-09,2010,1,Political violence,Violence against civilians,Attack,Police Forces of India (2004-2014) Border Security Force,,External/Other forces,Civilians (Bangladesh),Cattle Traders (Bangladesh),Civilians,External/Other forces-Civilians,Civilian targeting,50,South Asia,Bangladesh,Khulna,Satkhira,Satkhira Sadar,Satkhira,22.7082,89.0719,2,United News of Bangladesh,National,"On 9 November 2010, a Bangladeshi cattle-trader was injured in firing by Indian Border Security Force (BSF) at Gazipur frontier in sadar upazila, Satkhira.",0,,1650490660
PHL10766,2020-07-01,2020,1,Political violence,Violence against civilians,Attack,Unidentified Armed Group (Philippines),,Political militia,Civilians (Philippines),Former Military Forces of the Philippines (2016-2022),Civilians,Political militia-Civilians,Civilian targeting,608,Southeast Asia,Philippines,Bicol Region,Sorsogon,Donsol,Rawis,12.9029,123.6007,1,Philippine Daily Inquirer,National,"On 1 July 2020, an ex-soldier was shot dead by unidentified assailants in Barangay Rawis, Donsol, Sorsogon. The motive for the attack was unclear.",1,,1657063723
DEU22779,2024-10-06,2024,1,Strategic developments,Strategic developments,Other,Civilians (Germany),,Civilians,,,,Civilians only,,276,Europe,Germany,Schleswig-Holstein,Kiel,,Kiel,54.323,10.1356,1,Norddeutscher Rundfunk,National,"Other: On 6 October 2024, around 200 people gathered for a vigil and pro-Israel rally in Kiel (Schleswig-Holstein) to commemorate the 7 October 2023 and its victims. The event was organized by the DIG and the Coalition Against Antisemitism.",0,,1729023382
KEN4034,2013-09-03,2013,1,Demonstrations,Protests,Peaceful protest,Protesters (Kenya),,Protesters,,,,Protesters only,,404,Eastern Africa,Kenya,Nyeri,Nyeri Central,Rware,Nyeri,-0.4167,36.95,1,Star (Kenya),National,"Waving twigs and placards more than 200 internally displaced persons demonstrated in Nyeri town, demanding to be relocated.",0,,1618560749
BHR7675,2017-11-30,2017,1,Demonstrations,Protests,Peaceful protest,Protesters (Bahrain),Shiite Muslim Group (Bahrain),Protesters,,,,Protesters only,,48,Middle East,Bahrain,Northern,,,Barbar,26.2294,50.4806,1,Al Wafa,Other,"On 30 November 2017, a Shiite crowd took the streets in Barbar to demand that the government lifts the house arrest of Ayatollah Sheikh Isa Qasim and allows him to receive treatment amidst reports of his deteriorating health condition. Sheikh Isa Qasim has been under house arrest for more than 6 months.",0,,1698706754
GEO224,2019-01-24,2019,1,Demonstrations,Protests,Peaceful protest,Protesters (Georgia),,Protesters,,,,Protesters only,,268,Caucasus and Central Asia,Georgia,Autonomous Republic of Abkhazia,Gali,,Gali,42.6266,41.7381,1,Caucasian Knot,International,"On 24 January 2019, a protest was organized in Gali against closure of Ingur checkpoint with Georgia. Around 80 protesters participated.",0,crowd size=around 80,1702344276
CAN6551,2024-05-25,2024,1,Demonstrations,Protests,Peaceful protest,Protesters (Canada),Government of Canada (2015-); PC: Progressive Conservative,Protesters,,,,Protesters only,,124,North America,Canada,New Brunswick,Westmorland,,Moncton,46.0879,-64.7776,1,CTV News,National,"On 25 May 2024, around 30 local residents of Lewisville held a rally for the second day in a row in Moncton (New Brunswick) to protest against the American Iron & Metal (AIM) recycling operation near their homes and to show their concern about environmental and noise pollution.",0,crowd size=around 30,1719352948
PAK30303,2016-01-19,2016,1,Demonstrations,Protests,Peaceful protest,Protesters (Pakistan),APWHEWU: All Pakistan WAPDA Hydro Electric Workers Union; Labor Group (Pakistan),Protesters,,,,Protesters only,,586,South Asia,Pakistan,Sindh,Larkana,Larkana,Larkana,27.5637,68.215,1,Pakistan Observer,National,"All Pakistan WAPDA Hydero Electric Workers Union (CBA), Larkana, and Kamber Shahdadkot observed Yom-e-Mutalibaat in Larkana on Tuesday pressing the federal government to meet their demands and review proposed privatization of power producing companies. They gathered at Old Power House and locked their offices in Larkana before rallying.",0,,1667315946
LBN19545,2024-03-19,2024,1,Political violence,Explosions/Remote violence,Air/drone strike,Military Forces of Israel (2022-),,External/Other forces,,,,External/Other forces only,,422,Middle East,Lebanon,Al Nabatieh,Marjayoun,,Mays el Jabal,33.1691,35.5234,2,L'Orient Le Jour; Liveuamap; National News Agency Lebanon; Twitter,Local partner-New media,"On 19 March 2024, Israeli warplanes carried out an airstrike on Al Trash neighborhood in the southwestern vicinity of Mays el Jabal town (Marjayoun, Al Nabatieh) amid ongoing hostilities with Hezbollah. the Israeli military fired artillery shells in the vicinity of the town. There were no casualties.",0,,1727204951
NIG33235,2023-10-09,2023,1,Political violence,Battles,Armed clash,Military Forces of Nigeria (2023-),,State forces,Unidentified Armed Group (Nigeria),,Political militia,State forces-Political militia,,566,Western Africa,Nigeria,Taraba,Yorro,,Jimlari,9.0606,11.4355,2,Sun (Nigeria),National,"On 9 October 2023, Nigerian troops engaged an unidentified armed group in an armed clash around Jimlari village (Yorro, Taraba). The members of the group fled with many sustaining high degree of gunshot wounds, two abductees were rescued and the troops recovered items including a phone, 36 empty cases among others.",0,,1698075227
ESP12061,2022-12-12,2022,1,Demonstrations,Protests,Peaceful protest,Protesters (Spain),CGT: General Confederation of Labor (Spain); Labor Group (Spain),Protesters,,,,Protesters only,,724,Europe,Spain,Cataluna,Girona,,Girona,41.9841,2.8407,1,Diari De Girona,Subnational,"On 12 December 2022, around 30 cleaning workers, summoned by CGT, held a protest in front of the local government in Girona (Cataluna) to demand better wages and a decent agreement.",0,crowd size=around 30,1729023389
IND150099,2024-01-26,2024,1,Demonstrations,Protests,Peaceful protest,Protesters (India),AIFTU: All India Federation of Trade Unions; AITUC: All India Trade Union Congress; CITU: Centre of Indian Trade Unions; Farmers (India); Labor Group (India),Protesters,,,,Protesters only,,356,South Asia,India,Andhra Pradesh,Vizianagaram,Bobbili,Bobbili,18.5725,83.3564,1,Hans India,Subnational,"On 26 January 2024, members of the AITUC, the Rythu Sangam (farmer group), the AIFTU, the CITU and the Pensioners Association staged a protest at the Bobbili NTR Bomma Center in Bobbili town (Vizianagaram, Andhra Pradesh) accusing the BJP-led Union government of not implementing its promises. The protesters demanded the government to stop the privatization of steel plants, and to also provide a minimum wage and pension to workers.",0,crowd size=no report,1716919053
VEN19199,2023-02-13,2023,1,Demonstrations,Protests,Peaceful protest,Protesters (Venezuela),Teachers (Venezuela),Protesters,,,,Protesters only,,862,South America,Venezuela,Miranda,Guaicaipuro,,Los Teques,10.3445,-67.0433,1,La Patilla; OVCS: Observatorio Venezolano de Conflictividad Social; Reporte YA,Other-National,"On 13 February 2023, in Los Teques (Miranda), a group of teachers protested to demand better pay and working conditions, and against what they consider to be abuses of their working rights. The protesters marched from the Andres Bello Square to the Public Ministry Office.",0,crowd size=no report,1676922678
BFO6217,2022-01-14,2022,1,Political violence,Violence against civilians,Attack,Unidentified Armed Group (Burkina Faso),,Political militia,Civilians (Burkina Faso),Women (Burkina Faso),Civilians,Political militia-Civilians,Civilian targeting,854,Western Africa,Burkina Faso,Est,Gourma,Diabo,Maouda,12.1197,0.0632,2,AIB (Burkina Faso); Facebook; Gulmu Info; Sidwaya; Undisclosed Source,Local partner-Other,"On 14 January 2022, unknown gunmen ran a checkpoint and attacked civilians between Maouda (Diabo, Gourma) and Tilonti (Diapangou, Gourma). The gunmen attacked a communal transport bus and killed two women and one person severely. Cars and motorcycles were also stopped and the occupants robbed of their belongings. The gunmen were looking for members of the defense and security forces, which may indicate that they were militants rather than armed bandits.",2,,1702343245
PSE16997,2022-10-12,2022,1,Demonstrations,Riots,Violent demonstration,Rioters (Palestine),,Rioters,Military Forces of Israel (2021-2022),,External/Other forces,Rioters-External/Other forces,,275,Middle East,Palestine,West Bank,Al Quds,,Qalandia,31.8667,35.2167,1,Arab 48; Palestine News and Information Agency; PLO Negotiations Affairs Department; Quds News Network,Other-National,"On 12 October 2022, Palestinian rioters clashed with Israeli military forces positioned at Qalandia checkpoint (Al Quds, West Bank). Soldiers fired live and rubber bullets, stun grenades, and tear gas canisters at rioters. Clashes erupted after a general strike was declared in the West Bank in support of Mukhayyam Shuafat and Anata town and against the Israeli closure imposed on the Palestinian residents.",0,crowd size=no report,1716327878
IND36063,2018-09-06,2018,1,Demonstrations,Protests,Peaceful protest,Protesters (India),General Caste Group (India),Protesters,,,,Protesters only,,356,South Asia,India,Bihar,Nawada,Narhat,Pali Khurd,24.8209,85.4061,1,Hindustan Times,National,"On 6 September 2018, demonstrators from upper caste communities blocked trains in Tilaiya junction, in Pali Khurd village, Nawada district, Bihar, against the Scheduled Castes and Scheduled Tribes (Prevention of Atrocities) Act, as part of a nationwide Bharat Bandh.",0,,1652375171
DEU15882,2023-04-24,2023,1,Demonstrations,Protests,Protest with intervention,Protesters (Germany),Last Generation (Germany),Protesters,Police Forces of Germany (2021-),,State forces,State forces-Protesters,,276,Europe,Germany,Berlin,Berlin,,Berlin - Treptow-Kopenick,52.4175,13.6006,1,Berliner Morgenpost,Subnational,"On 24 April 2023, at the call of ALG, protesters blocked the Puschkinallee in Berlin - Treptow-Kopenick, to call for climate action. The protesters were removed from the street by the police. The protest was part of a series of protests by ALG in Berlin that day.",0,crowd size=no report,1707254000
IRQ12873,2016-03-12,2016,1,Political violence,Battles,Armed clash,Islamic State in Iraq and the Levant (ISIL),,Rebel group,Military Forces of Iraq (2014-2018) Popular Mobilization Forces,Military Forces of Iraq (2014-2018),State forces,State forces-Rebel group,,368,Middle East,Iraq,Ninewa,Telafar,Markaz Telafar,Ash Shariah,36.3481,42.2659,2,Anadolu Agency; AP; Shafaaq News,National-Regional,"On 3 December 2016, Islamic State militants attempted to break the siege of Tel Afar by launching an attack on Iraqi army and Popular mobilization positions in the village of Shariah on the road between Tel Afar and Sinjar, 13 PMF fighters and 17 militants were killed amidst the fighting.",30,,1730156774
UKR29876,2019-12-04,2019,1,Political violence,Battles,Armed clash,Military Forces of Ukraine (2019-),,State forces,NAF: United Armed Forces of Novorossiya,,Rebel group,State forces-Rebel group,,804,Europe,Ukraine,Donetsk,Donetskyi,Yasynuvatska,Donetsk Filtration Station,48.1331,37.808,2,OSCE SMM-Ukraine,Other,"On 4 December 2019, the OSCE SMM observed a total of 14 projectiles/bursts of fire involving heavy machineguns/unknown weapons in both directions of the frontline near Donetsk Filtration Station.",0,,1652377487
FRA11215,2021-08-14,2021,1,Demonstrations,Protests,Peaceful protest,Protesters (France),,Protesters,,,,Protesters only,,250,Europe,France,Nouvelle-Aquitaine,Charente,Angouleme,Angouleme,45.6478,0.1555,1,Sud Ouest,Subnational,"On 14 August 2021, between 850 (according to the police) and 3200 (according to organizers) people protested in Angouleme against coronavirus-related measures such as a mandatory 'health pass' to access French cultural venues as well as compulsory vaccination for all health workers.",0,crowd size=between 850 and 3200,1731445175
MEX13122,2019-12-17,2019,1,Demonstrations,Protests,Peaceful protest,Protesters (Mexico),Labor Group (Mexico),Protesters,,,,Protesters only,,484,North America,Mexico,Chiapas,San Cristobal de las Casas,,San Cristobal de las Casas,16.737,-92.6376,1,Diario Contra Poder en Chiapas,Subnational,"On 17 December 2019, in San Cristobal de las Casas, Chiapas, al least 10 fireworks vendors demonstrated to be able to sell in the Fair Park.",0,crowd size=at least 10,1612548758
UKR57800,2022-05-13,2022,1,Political violence,Explosions/Remote violence,Shelling/artillery/missile attack,Military Forces of Ukraine (2019-),,State forces,Military Forces of Russia (2000-) Air Force,,External/Other forces,State forces-External/Other forces,,804,Europe,Ukraine,Luhansk,Luhanskyi,Luhanska,Luhansk,48.567,39.3171,3,24 Channel,National,"On 13 May 2022, Ukrainian air defense shot down a Russian Mi-28 helicopter in Luhansk oblast. Casualties unknown.",0,,1652811458
LBY2806,2014-10-15,2014,1,Political violence,Explosions/Remote violence,Shelling/artillery/missile attack,Zintan Ethnic Militia (Libya),,Identity militia,Gharyan Communal Militia (Libya),,Identity militia,Identity militia-Identity militia,,434,Northern Africa,Libya,West,Al Jabal Al Gharbi,,Kiklah,32.0603,12.6965,1,Libya Herald,National,"Kiklah was shelled by Zintani forces. They captured it four days ago, but it was supposedly re-taken by Kikli and Gharyani forces two days ago.",0,,1715042098
AFG52807,2021-03-26,2021,2,Political violence,Violence against civilians,Attack,Military Forces of Afghanistan (2014-2021),,State forces,Civilians (Afghanistan),Labor Group (Afghanistan),Civilians,State forces-Civilians,Civilian targeting,4,Caucasus and Central Asia,Afghanistan,Laghman,Alishing,,Alishing,34.7835,70.1072,2,Voice of Jihad,Other,"Around 26 March 2021 (as reported), 1 driver was shot and killed by Afghan forces in Alishing district, Laghman. 1 shepherd was shot and wounded in the same area. Fatalities coded as 0 (VoJ reported 1).",0,,1731609836
EGY6804,2015-06-21,2015,1,Demonstrations,Protests,Peaceful protest,Protesters (Egypt),Women (Egypt),Protesters,,,,Protesters only,,818,Northern Africa,Egypt,Cairo,Al Nozha,,Cairo - Heliopolis,30.1088,31.3792,1,AP,International,"Dozens of women held a vigil outside Egypts presidential palace, challenging a law that restricts protests and calling for the release of thousands of prisoners detained for violating the protest law.",0,,1620775292
BRA5960,2019-06-25,2019,1,Demonstrations,Protests,Peaceful protest,Protesters (Brazil),Police Forces of Brazil (2019-2022) Civil Police; Police Forces of Brazil (2019-2022) Prison Guards,Protesters,,,,Protesters only,,76,South America,Brazil,Mato Grosso,Cuiaba,,Cuiaba,-15.5961,-56.0967,1,G1,National,"On 25 June 2019, in Cuiaba, Mato Grosso, approximately 100 Civil Police officers demonstrated against the proposed reform in the national pension system in front of the Department of Public Safety. They have also interrupted their activities and only emergency calls have been attended.",0,crowd size=100,1673316850
MMR8031,2016-04-07,2016,1,Demonstrations,Protests,Peaceful protest,Protesters (Myanmar),,Protesters,,,,Protesters only,,104,Southeast Asia,Myanmar,Shan-South,Taunggyi,Lawksawk,Lawksawk,21.2466,96.8651,1,Radio Free Asia,International,"On 7 April 2016, in Lawksawk Town, in Shan State, about 100 residents demonstrated by walking from the town city hall to an independence monument calling for justice over farmland issues.",0,crowd size=100,1618564942
PAK23980,2014-08-11,2014,1,Political violence,Riots,Mob violence,Rioters (Pakistan),Brohi Communal Group (Pakistan),Rioters,Rioters (Pakistan),Magsi Communal Group (Pakistan),Rioters,Rioters-Rioters,,586,South Asia,Pakistan,Sindh,Qambar Shahdadkot,Qubo Saeed Khan,Qubo Saeed Khan,27.8736,67.7065,1,Right Vision News,National,A clash between two communal militia groups in Qubo Saeed Khan left fifteen injured and two dead. The clash erupted over an issue related to a cell phone.,2,,1552577410
IND133804,2023-06-16,2023,1,Demonstrations,Protests,Peaceful protest,Protesters (India),,Protesters,,,,Protesters only,,356,South Asia,India,Jammu and Kashmir,Kathua,Kathua,Kathua,32.3867,75.5174,1,Amar Ujala,Subnational,"On 16 June 2023, locals of two villages held a protest at Kathua city (J&K) against the water department over damaging and diverting the water pipeline depriving them of water for over four days.",0,crowd size=no report,1719352728
ESP5290,2021-05-09,2021,1,Demonstrations,Protests,Peaceful protest,Protesters (Spain),Catholic Christian Group (Spain),Protesters,,,,Protesters only,,724,Europe,Spain,Galicia,Pontevedra,,Vilanova de Arousa,42.5622,-8.8265,1,La Voz De Galicia,Subnational,"On 9 May 2021, around 50 citizens gathered in Vilanova de Arousa (Pontevedra) to express support to the former sexton of the parish church accused of misappropriation of objects belonging to the church.",0,crowd size=around 50,1729023465
IND152240,2024-02-29,2024,1,Demonstrations,Protests,Peaceful protest,Protesters (India),Farmers (India); KKU: Kirti Kisan Union; KMM: Kisan Mazdoor Morcha; Labor Group (India); SKM (Non-political): United Farmers Front (Non-political),Protesters,,,,Protesters only,,356,South Asia,India,Punjab,Jalandhar,Jalandhar-I,Jalandhar,31.3255,75.5791,1,Chandigarh Tribune,Subnational,"On 29 February 2024, members of KKU, led by its District President, staged a dharna (sit-in protest), raising slogans, at the Deputy Commissioner's office in Jalandhar city (Punjab) condemning the excessive police intervention in the ongoing 'Delhi Chalo' (let's go to Delhi) farmer's protests led by SKM (Non-political), and KMM - which led to the death of a protester on 21 February (coded separately), and demanded the registration of First Information Report (FIR) against the accused. The protesters also demanded the removal of the agriculture sector from the World Trade Organization (WTO) agreement.",0,crowd size=no report,1716919053
SYR26595,2017-02-07,2017,1,Political violence,Explosions/Remote violence,Suicide bomb,Unidentified Armed Group (Syria),,Political militia,Civilians (Syria),,Civilians,Political militia-Civilians,Civilian targeting,760,Middle East,Syria,Damascus,Damascus,Damascus,Damascus - Al-Midan,33.4854,36.3005,1,Liveuamap,Local partner-New media,"An unidentified group detonated three car bombs near the near Tahrir Square, in addition to the Airport road and the Old City in Damascus, killing at least 9 and wounding 15. Three deaths are noted in this location, in addition to one suicide bomber.",4,,1720477958
NIG31480,2023-06-06,2023,1,Political violence,Battles,Armed clash,Katsina Communal Militia (Nigeria),,Identity militia,Dutsinma Communal Militia (Nigeria),,Identity militia,Identity militia-Identity militia,,566,Western Africa,Nigeria,Katsina,Dutsinma,,Makera,12.3117,7.4551,2,Daily Post (Nigeria); Vanguard (Nigeria),National,"On 6 June 2023, a Katsina militia killed a member of a local defense militia while he was working on his farm along Sanawa village in Makera (Dutsinma, Katsina).",1,,1719274238
