event_id_cnty,event_date,year,time_precision,disorder_type,event_type,sub_event_type,actor1,assoc_actor_1,inter1,actor2,assoc_actor_2,inter2,interaction,civilian_targeting,iso,region,country,admin1,admin2,admin3,location,latitude,longitude,geo_precision,source,source_scale,notes,fatalities,tags,timestamp
PSE18965,2021-02-08,2021,1,Political violence,Riots,Mob violence,Rioters (Palestine),,Rioters,Military Forces of Israel (2009-2021),,External/Other forces,Rioters-External/Other forces,,275,Middle East,Palestine,West Bank,Al Quds,,Al Quds - Isawiya,31.8031,35.287,1,PLO Negotiations Affairs Department,Other,"On 8 February 2021, Palestinian rioters threw rocks at Israeli military forces in Al Quds - Isawiya, after soldiers stormed the area to conduct search operations. The soldiers fired stun grenades and tear gas to disperse the rioters.",0,crowd size=no report,1715641869
KGZ701,2020-10-27,2020,1,Demonstrations,Protests,Peaceful protest,Protesters (Kyrgyzstan),,Protesters,,,,Protesters only,,417,Caucasus and Central Asia,Kyrgyzstan,Bishkek,Oktyabr,,Bishkek,42.8731,74.6003,1,AKIpress,National,"On 27 October 2020, about 40 protesters gathered outside the Mayor's Office in Bishkek city, demanding the city administration resolve their concerns regarding the legalization of the home properties on the disputed land.",0,crowd size=about 40,1730240821
IRQ20004,2019-04-15,2019,1,Political violence,Violence against civilians,Abduction/forced disappearance,Islamic State in Iraq and the Levant (ISIL),,Rebel group,Civilians (Iraq),,Civilians,Rebel group-Civilians,Civilian targeting,368,Middle East,Iraq,Ninewa,Al Baaj,Markaz Al Baaj,Al Baaj,36.0426,41.7163,2,Basnews,Subnational,"On 15 April 2019, IS militants disguised in military uniforms kidnapped two brothers in the district of al-Ba'aj, Nineveh province.",0,,1730156798
UKR85510,2022-12-21,2022,1,Political violence,Explosions/Remote violence,Shelling/artillery/missile attack,Military Forces of Russia (2000-),,External/Other forces,,,,External/Other forces only,,804,Europe,Ukraine,Zaporizhia,Polohivskyi,Orikhivska,Orikhiv,47.5673,35.7858,1,061.ua,Subnational,"On 21 December 2022, Russian forces shelled Orikhiv, Zaporizhia region. Casualties unknown.",0,,1715131306
NIC904,2023-03-15,2023,3,Strategic developments,Strategic developments,Other,Government of Nicaragua (2007-),,State forces,,,,State forces only,,558,Central America,Nicaragua,Managua,Managua,,Managua,12.1328,-86.2504,1,Confidencial; La Prensa (Nicaragua),National,"Other: Around 15 March 2023 (month of), in Managua, Managua, the government cancelled the legal personalities of four universities, namely University of Juan Pablo II, the Christian Autonomous University of Nicaragua (UCAN), Pan American University of Nicaragua Association (UPAN) and University of the Pacific Association (UNIP), arguing that both did not comply with legal requirements for their functioning.",0,,1680532132
FRA31887,2024-03-22,2024,1,Demonstrations,Protests,Peaceful protest,Protesters (France),CGT: General Confederation of Labor (France); Labor Group (France),Protesters,,,,Protesters only,,250,Europe,France,Normandie,Seine-Maritime,Le Havre,Le Havre,49.4959,0.1312,1,Revolution Permanente,National,"On 22 March 2024, at the call of CGT, around 300 Safran and TotalEnergies employees gathered in Le Havre (Normandie) to express solidarity with a colleague who was summoned for allegedly harassing his boss. The protesters condemned what they deemed a repression of unions.",0,crowd size=around 300,1727819769
FRA27981,2023-10-08,2023,1,Demonstrations,Protests,Peaceful protest,Protesters (France),SLT: Earth Uprisings,Protesters,,,,Protesters only,,250,Europe,France,Provence-Alpes-Cote d'Azur,Hautes-Alpes,Briancon,La Grave,45.046,6.3062,1,France 3 Regions,National,"On 8 October 2023, at the call of SLT, La Grave Autrement, and Mountain Wilderness, people, including environmental activists, gathered in La Grave (Provence-Alpes-Cote d'Azur) to protest against the construction of an additional ski lift in the area, which the protesters deemed damaging to the environment.",0,crowd size=no report,1697584397
ISR11605,2022-01-12,2022,1,Demonstrations,Riots,Violent demonstration,Rioters (Israel),Bedouin Ethnic Group (Israel),Rioters,Police Forces of Israel (2021-2022),,State forces,State forces-Rioters,,376,Middle East,Israel,HaDarom,Beer Sheva,Beer Sheva,Nevatim,31.2242,34.881,2,Arutz Sheva; Haaretz,National,"On 12 January 2022, local youth Bedouins rioted near Nevatime (HaDarom, Beer Sheva) against the ongoing state's project to plant a forest around their desert communities, which they claimed aimed to prevent these from expending. The rioters stoned passing cars that they suspected to be driven by Jews. The road was temporarily closed by the police, which removed the rioters using tear gas and arrested several of them. The incident coincided with a wave of Bedouin riots, leading the government to suspend the tree planting under pressure from the Bedouin-predominantly coalition's Raa'm Party. The controversy is part of a decades-long dispute between the Israeli authorities and some of the country's Bedouin residents over land ownership in the southern Negev Desert, which caused thousands of them to lack basic infrastructure.",0,crowd size=no report,1673316855
MEX78273,2023-08-27,2023,1,Political violence,Riots,Mob violence,Rioters (Mexico),Vigilante Group (Mexico),Rioters,Civilians (Mexico),,Civilians,Rioters-Civilians,Civilian targeting,484,North America,Mexico,Hidalgo,Tulancingo de Bravo,,Tulancingo,20.0806,-98.3681,1,El Sol de Hidalgo; La Silla Rota,Subnational-National,"On 27 August 2023, in Tulancingo, Hidalgo, at least 30 people beaten up a young man who was accuse to be a thief in Colonia paraiso.",0,crowd size=at least 30,1693853090
PAK11295,2012-04-08,2012,1,Political violence,Explosions/Remote violence,Remote explosive/landmine/IED,TTP: Tehreek-i-Taliban Pakistan,,Rebel group,Military Forces of Pakistan (2008-2013),,State forces,State forces-Rebel group,,586,South Asia,Pakistan,FATA,North Waziristan Agency,Miran Shah,Miranshah,33.0001,70.0698,1,Right Vision News,National,"Four personnel's of Tochi Scouts were injured in a roadside bomb blast near Miranshah, on Sunday. A vehicle of the Tochi Scouts was hit by a roadside bomb planted at Miranshah-Datakhel road. Four personnel were injured in the incident. Officials said the FC men were taking ration for the security forces in the mountains when came under attack. No group claimed responsibility for the attack.",0,,1614792735
MLI5186,2021-06-03,2021,1,Political violence,Battles,Armed clash,Islamic State West Africa Province (ISWAP) - Greater Sahara Faction,,Rebel group,Platform of June 14th 2014 movements,GATIA: Imghad Tuareg and Allies Self-Defense Group; MSA: Movement for Azawad Salvation,Political militia,Rebel group-Political militia,,466,Western Africa,Mali,Menaka,Tidermene,Tidermene,Agare MBaou,16.2071,2.1911,2,Al Naba; Essor; MSA Azawad; Nashir; Radio Guintan; Undisclosed Source,Local partner-Other,"On 3 June 2021, presumed ISWAP (Greater Sahara) militants attacked the hamlet of Inkinbabane, near Agare MBaou (Tidermene, Menaka). The militants killed eleven people, including four fighters of the Platform alliance (GATIA or MSA) and seven civilians, and seized livestock. ISWAP claimed responsibility and said its fighters ambushed a GATIA patrol, killed 13 militiamen and seized rifles and motorcycles.",11,,1731445547
AZE15910,2020-09-05,2020,1,Political violence,Battles,Armed clash,Military Forces of Armenia (2018-),,External/Other forces,Military Forces of Azerbaijan (2003-),,State forces,State forces-External/Other forces,,31,Caucasus and Central Asia,Azerbaijan,Tovuz,,,Aghdam,40.9053,45.5564,2,Ministry of Defence of Azerbaijan,Other,"On 5 September 2020, military forces of Armenia located at Aghdam fired with unspecified weapons on the positions of the military forces of Azerbaijan assumed to be located near Aghdam, Tovuz.",0,,1599503175
PSE17150,2022-10-19,2022,1,Demonstrations,Riots,Violent demonstration,Rioters (Palestine),,Rioters,Military Forces of Israel (2021-2022),,External/Other forces,Rioters-External/Other forces,,275,Middle East,Palestine,West Bank,Ramallah and Al Bireh,,Al Bireh,31.9053,35.215,1,Palestine News and Information Agency; PLO Negotiations Affairs Department; Quds News Network; Twitter,Other-New media,"On 19 October 2022, Palestinian demonstrators clashed with Israeli military forces positioned at the northern entrance of Al Bireh city near Bayt El (Ramallah and Al Bireh, West Bank), during a demonstration against the killing of a Palestinian gunman who carried out 2 shooting attacks in Shuafat and Maale Adumim.",0,crowd size=no report,1716327878
YEM31218,2019-05-06,2019,1,Political violence,Explosions/Remote violence,Shelling/artillery/missile attack,Military Forces of Yemen (2017-) Houthi,,State forces,Civilians (Yemen),,Civilians,State forces-Civilians,Civilian targeting,887,Middle East,Yemen,Al Hudaydah,Hays,,Hays,13.9317,43.4831,2,Al Sahwah; Yemen Data Project,Local partner-National,"On 6 May 2019, pro-Houthi forces reportedly fired Howitzer artillery shells and RPGs at residential areas in Hays district in the south of Hodeidah governorate, western Yemen, injuring a woman and damaging a number of houses.",0,,1719872685
SUD3590,2010-02-11,2010,1,Political violence,Battles,Armed clash,Military Forces of Sudan (1989-2019),,State forces,SLM/A: Sudan Liberation Movement/Army,,Rebel group,State forces-Rebel group,,729,Northern Africa,Sudan,North Darfur,Al Fasher,,El Fasher,13.6264,25.3559,2,Sudan Tribune,National,SLM repels attacking government troops. No rebel fatality number available.,64,,1632239613
FRA30276,2024-01-23,2024,1,Demonstrations,Protests,Peaceful protest,Protesters (France),Students (France),Protesters,,,,Protesters only,,250,Europe,France,Pays de la Loire,Loire-Atlantique,Nantes,Nantes,47.2184,-1.5536,1,France 3 Regions,National,"On 23 January 2024, students blocked access to the university building in Nantes (Pays de la Loire) to protest against the government's immigration law, which they deemed xenophobic, unfair to migrants, and inspired by far-right ideas. The event took place ahead of the Constitutional Council's decision on the law's constitutionality, set to be issued on 25 January 2024.",0,crowd size=no report,1706649907
PSE29191,2018-04-25,2018,1,Political violence; Demonstrations,Protests,Excessive force against protesters,Protesters (Palestine),,Protesters,Military Forces of Israel (2009-2021),,External/Other forces,Protesters-External/Other forces,Civilian targeting,275,Middle East,Palestine,Gaza Strip,Khan Yunis,,Khan Yunis,31.3502,34.3081,2,PLO Negotiations Affairs Department,Other,"On 25 April 2018, Palestinian protesters held a demonstration east of Khan Yunis city (Khan Yunis) in support of the Right of Return. Israeli forces fired live ammunition, rubber bullets, and stun and tear gas canisters, towards protesters while positioned behind the Green Line. 1 Palestinian was injured.",0,crowd size=no report,1699319484
IND99269,2021-08-07,2021,1,Demonstrations,Protests,Peaceful protest,Protesters (India),AITUC: All India Trade Union Congress; CITU: Centre of Indian Trade Unions; AIFTU: All India Federation of Trade Unions; Labor Group (India),Protesters,,,,Protesters only,,356,South Asia,India,Telangana,Hyderabad,Asifnagar,Hyderabad,17.384,78.4563,1,The Hindu,National,"On 7 August 2021, members of the CITU, AITUC, and IFTU held a protest in Hyderabad city (Hyderabad, TS) demanding an increase in the minimum wage offered to municipal workers.",0,crowd size=no report,1631058270
USA57475,2023-06-25,2023,2,Strategic developments,Strategic developments,Other,GDL: Goyim Defense League,,Identity militia,,,,Identity militia only,,840,North America,United States,Iowa,Linn,,Cedar Rapids,41.9738,-91.6768,1,Gazette (Iowa),Subnational,"Non-violent activity: Around 25 June 2023 (weekend of), antisemitic flyers were disseminated in Cedar Rapids (Iowa) which promoted the Goyim Defense League with anti-LGBTQ+ language.",0,,1709061633
PAK33253,2016-09-30,2016,1,Political violence,Violence against civilians,Attack,Unidentified Armed Group (Pakistan),,Political militia,Civilians (Pakistan),ASWJ: Ahle Sunnat Wal Jamaat,Civilians,Political militia-Civilians,Civilian targeting,586,South Asia,Pakistan,Khyber Pakhtunkhwa,Batagram,Batagram,Battagram,34.6766,73.0271,1,News International (Pakistan),National,"District chief of the Ahl-e-Sunnat Wal Jamaat (ASWJ), Maulana Momin Shah Haideri, escaped an attempt on his life when unidentified armed men opened fire on him.",0,,1561474244
SOM14320,2014-03-23,2014,1,Political violence,Battles,Armed clash,Military Forces of Somalia (2012-2017),,State forces,Al Shabaab,,Rebel group,State forces-Rebel group,,706,Eastern Africa,Somalia,Banadir,Banadir,,Mogadishu - Yaqshid,2.0678,45.35,1,Calamada,National,Al-Shabaab forces clashed with the government militia at the former television centre at Afgooye Road junction in Yaaqshiid District. Casualties not known. Radio Andalus is pro al Shabaab.,0,,1702343757
PAK44265,2018-09-18,2018,1,Political violence,Battles,Armed clash,Unidentified Armed Group (Pakistan),,Political militia,Police Forces of Pakistan (2018-2022) Balochistan Levies,,State forces,State forces-Political militia,,586,South Asia,Pakistan,Balochistan,Killa Saifullah,Killa Saifullah,Qila Saifullah,30.6983,68.3547,1,Pakistan Today,National,"On Sep 18, unidentified gunmen on motorcycles attacked Levies personnel in the Main Bazaar of Qila Saifullah town (Balochistan). 2 Levies were killed and another was critically injured.",2,,1650396994
DEU11998,2022-03-25,2022,1,Demonstrations,Protests,Peaceful protest,Protesters (Germany),FFF: Fridays for Future; Students (Germany),Protesters,,,,Protesters only,,276,Europe,Germany,Schleswig-Holstein,Pinneberg,,Elmshorn,53.7532,9.6524,1,Norddeutscher Rundfunk,National,"On 25 March 2022, people demonstrated in Elmshorn at the call of FFF to demand immediate climate protection.",0,crowd size=no report,1680633670
NIG27572,2020-08-03,2020,1,Political violence,Violence against civilians,Attack,Katsina Communal Militia (Nigeria),,Identity militia,Civilians (Nigeria),,Civilians,Identity militia-Civilians,Civilian targeting,566,Western Africa,Nigeria,Katsina,Batsari,,Yau-Yau Malamawa,12.9778,7.3163,1,"Risk and Strategic Management, Corporation",Local partner-International,"On 3 August 2020, Katsina gunmen attacked and killed one person in Yau-Yau Malamawa ward (Batsari, Katsina).",1,,1666026859
BFO8394,2022-10-19,2022,1,Strategic developments,Strategic developments,Other,JNIM: Group for Support of Islam and Muslims,,Rebel group,Civilians (Burkina Faso),Labor Group (Burkina Faso),Civilians,Rebel group-Civilians,,854,Western Africa,Burkina Faso,Centre-Nord,Namentenga,Tougouri,Tougouri,13.3164,-0.5225,2,Whatsapp,New media,"Non-violent activity: On 19 October 2022, presumed JNIM militants ran a checkpoint and searched a communal transport bus near Tougouri (Tougouri, Namentenga).",0,,1724113663
MOR11938,2024-09-17,2024,1,Demonstrations,Protests,Peaceful protest,Protesters (Morocco),Labor Group (Morocco),Protesters,,,,Protesters only,,504,Northern Africa,Morocco,Oriental,Nador,Bni Ansar,Beni Ansar,35.26,-2.93,1,Nador City,Subnational,"On 17 September 2024, workers at Karama Recyclage company held a protest in front of their factory in Beni Ansar, Bni Ansar (Nador, Oriental) to denounce the closure of the border with the Spanish enclave of Melilla causing the suspension of informal trade activities.",0,crowd size=no report,1727134597
SYR118341,2023-09-29,2023,1,Political violence,Battles,Armed clash,National Police Forces,,Rebel group,Hamza Brigade,Al Qar'an Tribal Militia (Syria),Rebel group,Rebel group-Rebel group,,760,Middle East,Syria,Al Hasakeh,Ras Al Ain,Ras Al Ain,Ras al-Ain,36.8494,40.0747,1,Facebook; SHAAM; SOHR,Other-New media,"On 29 September 2023, clashes took place between National Police Forces and Hamza Brigade members whom are from Al Qar'an tribe in Ras al-Ain town in Al Hasakeh countryside, using RPG and mortar shells as well as heavy machine guns, killing one National Police Forces member, and seriously injuring three others, and the burning of four cars. 1 fatality.",1,,1720478998
PER5103,2022-09-05,2022,1,Demonstrations,Protests,Peaceful protest,Protesters (Peru),,Protesters,,,,Protesters only,,604,South America,Peru,La Libertad,Trujillo,Trujillo,Trujillo,-8.116,-79.03,1,Diario Correo (Peru),National,"On 5 September 2022, in Trujillo (La Libertad), dozens of Alto Trujillo residents staged a demonstration in Armas square to reject the leader of the Alliance for Progress (APP) political party after he supported a law that would transform their sector into a district, benefiting himself. The residents carried out a flag washing as part of a demonstration.",0,crowd size=dozens,1663006806
PSE3133,2016-11-10,2016,1,Strategic developments,Strategic developments,Other,Military Forces of Israel (2009-2021),,External/Other forces,Civilians (Palestine),Fishers (Palestine),Civilians,External/Other forces-Civilians,,275,Middle East,Palestine,Gaza Strip,North Gaza,,Coast of North Gaza,31.5839,34.4659,2,Jordan News Agency,International,"Other: Thursday 10th of Nov 2016, Israeli vessels opened fire on a number of Palestinian fishing boats off the coast of the As-Sudaniya area of Bayt Lahya, northern Gaza Strip. These shots are considered to be warning shots to keep Palestinians away, not directly targeted at them. There were no casualties.",0,,1670274991
PSE39623,2023-11-03,2023,1,Political violence,Battles,Armed clash,AAMB: Katibat Tulkarm - Quick Response,,Political militia,Military Forces of Israel (2022-),,External/Other forces,Political militia-External/Other forces,,275,Middle East,Palestine,West Bank,Jenin,,At Taybah,32.5149,35.1857,1,Newpress,National,"On 3 November 2023, Katibat Tulkarm - Quick Response (AAMB) militants opened fire at Israeli forces at At Taybah checkpoint (Jenin, West Bank). No casualties occurred.",0,,1725924071
UKR106410,2023-06-03,2023,1,Political violence,Battles,Armed clash,Military Forces of Russia (2000-),Military Forces of Russia (2000-) Air Force,External/Other forces,Military Forces of Ukraine (2019-),,State forces,State forces-External/Other forces,,804,Europe,Ukraine,Donetsk,Pokrovskyi,Marinska,Marinka,47.9425,37.505,2,Ministry of Defence of Ukraine,Other,"On 3 June 2023, Russian forces engaged in an unsuccessful offensive in the direction of Marinka, Donetsk, carrying out airstrikes and were repelled by Ukrainian forces. Casualties unknown.",0,,1686674857
BRA19103,2020-11-07,2020,1,Demonstrations,Protests,Peaceful protest,Protesters (Brazil),Women (Brazil),Protesters,,,,Protesters only,,76,South America,Brazil,Santa Catarina,Criciuma,,Criciuma,-28.6733,-49.3723,1,G1,National,"On 7 November 2020, in Criciuma, Santa Catarina, women carried out a march to demand justice for a rape victim who was verbally and psychologically abused by the defendant's lawyer and the prosecutor during her hearing trial.",0,crowd size=no report,1604954095
UKR179327,2024-02-02,2024,1,Political violence,Explosions/Remote violence,Shelling/artillery/missile attack,Military Forces of Russia (2000-),,External/Other forces,Military Forces of Ukraine (2019-),,State forces,State forces-External/Other forces,,804,Europe,Ukraine,Kherson,Khersonskyi,Darivska,Tokarivka,46.7504,32.9513,1,WarGonzo,National,"On 2 February 2024, Russian Forces likely shelled Ukrainian positions in Tokarivka, Kherson. Casualties unknown.",0,,1726615190
ARM1847,2019-02-03,2019,1,Political violence,Battles,Armed clash,Military Forces of Azerbaijan (2003-),,External/Other forces,Military Forces of Armenia (2018-),,State forces,State forces-External/Other forces,,51,Caucasus and Central Asia,Armenia,Syunik,Meghri,,Agarak,38.8638,46.1954,2,Ministry of Foreign Affairs of Armenia,Other,"On 3 February 2019, military forces of Azerbaijan fired with small arms/sniper rifles on the positions of the military forces of Armenia located near Agarak, Meghri.",0,,1649875366
BUR9186,2019-01-10,2019,2,Political violence,Violence against civilians,Attack,Unidentified Armed Group (Burundi),,Political militia,Civilians (Burundi),,Civilians,Political militia-Civilians,Civilian targeting,108,Eastern Africa,Burundi,Kirundo,Busoni,Ruheha,Nyagisozi,-2.4782,30.2875,2,Humura,New media,"On or before 01 October. A dead body was found near the Rweru river in Nyagisozi, Kirundo. Local residents say the SNR carried out the attack, as they saw a leader of the SNR in the area just before the body was found. This is speculation and has not been confirmed. The body was quickly buried without an investigation.",1,,1571091923
UKR56083,2022-04-18,2022,1,Political violence,Battles,Armed clash,Military Forces of Russia (2000-) Chechen Battalion of Ramzan Kadyrov,,External/Other forces,Military Forces of Russia (2000-),,External/Other forces,External/Other forces-External/Other forces,,804,Europe,Ukraine,Zaporizhia,Zaporizkyi,Zaporizka,Zaporizhia,47.8479,35.1602,3,24 Channel,National,"On 18 April 2022, Russian soldiers in Zaporizhia region refused to participate in hostilities because they were not paid wages. In response to that, servicemen of Chechen Battalion of Ramzan Kadyrov executed three Russian soldiers.",3,,1650997734
UKR109746,2023-06-24,2023,1,Political violence,Explosions/Remote violence,Shelling/artillery/missile attack,Military Forces of Russia (2000-),,External/Other forces,,,,External/Other forces only,,804,Europe,Ukraine,Sumy,Shostkynskyi,Druzhbivska,Chuikivka,52.0296,34.0037,1,Ministry of Defence of Ukraine,Other,"On 24 June 2023, Russian forces fired mortars and artillery at Chuikivka, Sumy. Casualties unknown.",0,,1722974448
ETH3793,2017-05-02,2017,1,Political violence,Battles,Armed clash,AGUDM: Patriotic Ginbot 7 for Unity and Democratic Movement,,Rebel group,Military Forces of Ethiopia (1991-2018),,State forces,State forces-Rebel group,,231,Eastern Africa,Ethiopia,Amhara,South Gondar,Libokemekem,Addis Zemen,12.1167,37.7833,1,ESAT,International,Three soldiers were killed on Tuesday as their convoy came under attack by Ginbot 7 troops in Addis Zemen near Metmiku Yohannes Monastery.,3,,1618529950
PAR4444,2023-04-23,2023,1,Political violence,Riots,Mob violence,Rioters (Paraguay),Vigilante Group (Paraguay),Rioters,,,,Rioters only,,600,South America,Paraguay,Amambay,Pedro Juan Caballero,,Pedro Juan Caballero,-22.5472,-55.7333,1,ABC Color,National,"On 23 April 2023, in Pedro Juan Caballero (Amambay), a group of rioters set fire to the house of a suspected drug dealer over the killing of a girl. The rioters blamed the death of the girl on drug trafficking in the area. The owner of the house had been arrested by the police after drugs were found inside. There were no casualties.",0,crowd size=no report,1683046241
FRA22594,2023-03-01,2023,1,Demonstrations,Protests,Peaceful protest,Protesters (France),CFDT: French Democratic Confederation of Labor; CGT: General Confederation of Labor (France); Labor Group (France),Protesters,,,,Protesters only,,250,Europe,France,Nouvelle-Aquitaine,Correze,Brive-la-Gaillarde,Brive-la-Gaillarde,45.1451,1.5143,1,La Montagne,Subnational,"On 1 March 2023, striking workers gathered for a rally organized by CFDT and CGT at the Eurocast site, in the Teinchurier area of Brive-la-Gaillarde, in support of higher wages due to inflation.",0,crowd size=no report,1731445280
KOR37810,2024-10-14,2024,1,Demonstrations,Protests,Peaceful protest,Protesters (South Korea),KCTU: Korean Confederation of Trade Unions; Labor Group (South Korea),Protesters,,,,Protesters only,,410,East Asia,South Korea,Ulsan,Nam,,Ulsan - Nam,35.5123,129.3348,1,Hankyoreh,National,"On 14 October 2024, unionized employees of HD Hyundai Heavy Industries (KCTU affiliate) held a press conference and displayed banners at the Ulsan Metropolitan City Hall (Ulsan - Nam), criticizing the company's alleged violence against union members during the walkout. They demanded an apology and a pledge to prevent recurrences.",0,crowd size=no report,1729632726
KAZ2710,2021-12-02,2021,1,Demonstrations,Protests,Peaceful protest,Protesters (Kazakhstan),Labor Group (Kazakhstan),Protesters,,,,Protesters only,,398,Caucasus and Central Asia,Kazakhstan,Mangystau,Aktau,,Aktau,43.6624,51.1702,1,Lada,National,"On 2 December 2021, workers of the Caspi Bittum company protested outside their main office in Aktau city of Mangystau region demanding fifty percent pay raise and calling for the country's president to assist them with resolving their labor dispute between protesters and their employer.",0,crowd size=no report,1729632723
SYR11276,2017-08-21,2017,1,Political violence,Explosions/Remote violence,Shelling/artillery/missile attack,Unidentified Armed Group (Syria),,Political militia,,,,Political militia only,,760,Middle East,Syria,Rural Damascus,Rural Damascus,Babella,Sayyeda Zeinab,33.4466,36.3406,1,SOHR,Other,A shell fell on Sayyeda Zeinab town in Rural Damascus. No fatalities were reported.,0,,1720478136
AFG16660,2019-02-20,2019,1,Political violence,Explosions/Remote violence,Shelling/artillery/missile attack,Military Forces of Afghanistan (2014-2021),,State forces,Taliban,,Rebel group,State forces-Rebel group,,4,Caucasus and Central Asia,Afghanistan,Zabul,Qalat,,Qalat,32.1058,66.9083,3,Bakhtar News Agency,National,"On 20 February 2019, 10 Taliban militants were killed and 4 were wounded by artillery fire conducted by Afghan Military Forces in Zabul province.",10,,1652376175
